{
  "id": "fac_bosnia",
  "name": {
    "display": "Banat de Bosnie",
    "local": "Бановина Босна",
    "local_language": "serbe"
  },
  "short_name": "Bosnie",
  "adjective": "bosniaque",
  "government": "kingdom",
  "playable": true,
  "ruler": "chr_stjepan_ii_kotromanic",
  "capital": "prov_bosnia",
  "capital_city": "Visoko",
  "religion": "rel_catholic",
  "culture": "cul_bosnian",
  "succession_law": "male_preference_primogeniture",
  "primary_title": "tit_bosnia",
  "heraldry": {
    "blazon": "D'azur à la bande d'argent accompagnée de six fleurs de lis d'or.",
    "description": "Armes des Kotromanić : bande d’argent entre six fleurs de lis d’or sur azur, d’inspiration angevine (le rendu simplifié des factions ne trace que la bande).",
    "primary_color": "#1F3E8F",
    "secondary_color": "#F5F1E6",
    "uncertain": true,
    "note": "Attestées sous Tvrtko Ier ; ici étendues à Étienne II."
  },
  "titles": [
    "Ban de Bosnie",
    "Seigneur de Hum"
  ],
  "treasury": 6000,
  "prestige": 35,
  "starting_technologies": [
    "tech_water_mills",
    "tech_three_field_rotation",
    "tech_masonry"
  ],
  "relations": [
    {
      "faction": "fac_serbia",
      "status": "peace",
      "note": "Le Hum a été enlevé aux Serbes en 1326 ; la rivalité reste vive."
    },
    {
      "faction": "fac_venice",
      "status": "peace",
      "note": "Commerce vers Raguse et Cattaro."
    },
    {
      "faction": "fac_hungary",
      "status": "peace",
      "note": "Le ban de Bosnie reconnaît la suzeraineté hongroise."
    }
  ],
  "claims": [
    {
      "kind": "province",
      "province": "prov_ragusa",
      "note": "Débouché maritime convoité."
    }
  ],
  "ai_personality": {
    "aggression": 55,
    "diplomacy": 60,
    "trade": 45,
    "piety": 50
  },
  "description": "Banat de Bosnie d’Étienne II Kotromanić, ban depuis 1322, qui a annexé le Hum en 1326 et se pose en arbitre entre la Hongrie, la Serbie et Venise.",
  "sources": [
    "Stephen II, Ban of Bosnia",
    "Banat de Bosnie"
  ]
}
