{
  "id": "fac_navarre",
  "name": {
    "display": "Royaume de Navarre",
    "local": "Regno de Navarra",
    "local_language": "navarro-aragonais"
  },
  "short_name": "Navarre",
  "adjective": "navarrais",
  "government": "kingdom",
  "playable": false,
  "ruler": "chr_jeanne_ii_de_navarre",
  "capital": "prov_navarra",
  "capital_city": "Pampelune",
  "religion": "rel_catholic",
  "culture": "cul_navarrese",
  "succession_law": "cognatic_primogeniture",
  "primary_title": "tit_navarre",
  "heraldry": {
    "blazon": "De gueules aux chaînes d'or posées en orle, en croix et en sautoir.",
    "description": "Chaînes d’or sur champ rouge, sans émeraude (le cœur de gemme n’est attesté qu’au XVe siècle) ; les chaînes remplacent l’ancien escarboucle.",
    "primary_color": "#B0182B",
    "secondary_color": "#F2C230"
  },
  "titles": [
    "Reine de Navarre"
  ],
  "treasury": 8000,
  "prestige": 40,
  "starting_technologies": [
    "tech_water_mills",
    "tech_three_field_rotation",
    "tech_masonry"
  ],
  "relations": [
    {
      "faction": "fac_france",
      "status": "marriage_tie",
      "note": "Jeanne II, fille de Louis X, a renoncé à la Champagne et à la Brie (1336) contre Angoulême et Mortain."
    },
    {
      "faction": "fac_castile",
      "status": "peace"
    },
    {
      "faction": "fac_aragon",
      "status": "peace"
    }
  ],
  "ai_personality": {
    "aggression": 40,
    "diplomacy": 65,
    "trade": 45,
    "piety": 60
  },
  "description": "Petit royaume pyrénéen gouverné par Jeanne II, dernière Capétienne directe, et son mari Philippe d’Évreux, avec de vastes possessions normandes (Évreux, Mortain).",
  "sources": [
    "Jeanne II de Navarre",
    "Philippe III de Navarre",
    "Armoiries de la Navarre"
  ],
  "heir": "chr_charles_ii_de_navarre"
}
