{
  "id": "fac_venice",
  "name": {
    "display": "République de Venise",
    "local": "Serenìsima Repùblica Vèneta",
    "local_language": "vénitien"
  },
  "short_name": "Venise",
  "adjective": "vénitien",
  "government": "republic",
  "playable": false,
  "ruler": "chr_francesco_dandolo",
  "capital": "prov_venezia",
  "capital_city": "Venise",
  "religion": "rel_catholic",
  "culture": "cul_venetian",
  "succession_law": "elective",
  "primary_title": "tit_venice",
  "heraldry": {
    "blazon": "De gueules au lion de saint Marc d'or.",
    "description": "Lion ailé de l’évangéliste Marc, patron de la cité.",
    "primary_color": "#9B1B1B",
    "secondary_color": "#E8B923"
  },
  "titles": [
    "Doge de Venise",
    "Seigneur d'un quart et demi de l'Empire romain"
  ],
  "treasury": 45000,
  "prestige": 60,
  "starting_technologies": [
    "tech_water_mills",
    "tech_three_field_rotation",
    "tech_masonry",
    "tech_bookkeeping",
    "tech_double_entry",
    "tech_letters_of_credit",
    "tech_royal_taxation"
  ],
  "relations": [
    {
      "faction": "fac_verona",
      "status": "war",
      "since": {
        "value": "1336-06-22"
      },
      "note": "Ligue de Venise, Florence et des Visconti contre Mastino II (1336-1339) ; Padoue tombe en août 1337."
    },
    {
      "faction": "fac_florence",
      "status": "alliance",
      "note": "Ligue contre les Scaliger (1336)."
    },
    {
      "faction": "fac_mamluks",
      "status": "peace",
      "note": "Commerce d'Alexandrie malgré l'interdit pontifical."
    },
    {
      "faction": "fac_aydin",
      "status": "war",
      "note": "Umur Bey razzie l'Égée ; ligue chrétienne et prise de Smyrne en 1344."
    },
    {
      "faction": "fac_ragusa",
      "status": "overlord",
      "note": "Suzeraineté sur Raguse depuis 1205."
    },
    {
      "faction": "fac_byzantium",
      "status": "peace",
      "note": "Traité de commerce avec Andronic III ; Venise convoite les îles de l'Égée."
    },
    {
      "faction": "fac_hospitallers",
      "status": "alliance",
      "note": "Ligue anti-turque de 1334 avec Rhodes et Chypre.",
      "since": {
        "value": "1334"
      }
    },
    {
      "faction": "fac_cyprus",
      "status": "alliance",
      "note": "Ligue anti-turque de 1334.",
      "since": {
        "value": "1334"
      }
    }
  ],
  "ai_personality": {
    "aggression": 40,
    "diplomacy": 60,
    "trade": 95,
    "piety": 40
  },
  "description": "Thalassocratie marchande : galées de Romanie et de Flandre, Arsenal, Grand Conseil fermé depuis 1297. Alliée des [[cdx_carrare|Carrare]], qui reprennent Padoue aux Scaliger en août 1337, elle obtiendra Trévise en 1339 : premier pied sur la Terre Ferme.",
  "sources": [
    "République de Venise",
    "Francesco Dandolo"
  ]
}
